{
  "cohort_id": "pilot-cohort-2026w08",
  "generated_utc": "2026-02-15T20:07:23.868268+00:00",
  "nodes": [
    {
      "cpu_cores": 1,
      "failure_reason": "",
      "hardware_tier": "unknown",
      "memory_gb": 1,
      "metrics_path": "pilot/nodes/volunteer-node-001/pilot_metrics.json",
      "network_tier": "unknown",
      "node_id": "volunteer-node-001",
      "onboarding_checked_utc": "2026-02-15T20:07:23.867031+00:00",
      "onboarding_status": "passed",
      "region": "unknown"
    },
    {
      "cpu_cores": 1,
      "failure_reason": "",
      "hardware_tier": "unknown",
      "memory_gb": 1,
      "metrics_path": "pilot/nodes/volunteer-node-local-smoke2/pilot_metrics.json",
      "network_tier": "unknown",
      "node_id": "volunteer-node-local-smoke2",
      "onboarding_checked_utc": "2026-02-15T20:07:23.867473+00:00",
      "onboarding_status": "passed",
      "region": "unknown"
    },
    {
      "cpu_cores": 1,
      "failure_reason": "",
      "hardware_tier": "unknown",
      "memory_gb": 1,
      "metrics_path": "pilot/nodes/volunteer-node-local-smoke3/pilot_metrics.json",
      "network_tier": "unknown",
      "node_id": "volunteer-node-local-smoke3",
      "onboarding_checked_utc": "2026-02-15T20:07:23.867488+00:00",
      "onboarding_status": "passed",
      "region": "unknown"
    },
    {
      "cpu_cores": 12,
      "failure_reason": "",
      "hardware_tier": "mid",
      "memory_gb": 32,
      "metrics_path": "pilot/nodes/volunteer-node-local-smoke4/pilot_metrics.json",
      "network_tier": "home-broadband",
      "node_id": "volunteer-node-local-smoke4",
      "onboarding_checked_utc": "2026-02-15T20:07:23.867745+00:00",
      "onboarding_status": "passed",
      "region": "us-central"
    },
    {
      "cpu_cores": 12,
      "failure_reason": "",
      "hardware_tier": "low",
      "memory_gb": 32,
      "metrics_path": "pilot/nodes/volunteer-node-local-smoke5/pilot_metrics.json",
      "network_tier": "home-broadband",
      "node_id": "volunteer-node-local-smoke5",
      "onboarding_checked_utc": "2026-02-15T20:07:23.868109+00:00",
      "onboarding_status": "passed",
      "region": "us-north"
    },
    {
      "cpu_cores": 12,
      "failure_reason": "",
      "hardware_tier": "mid",
      "memory_gb": 32,
      "metrics_path": "pilot/nodes/volunteer-node-local-smoke6/pilot_metrics.json",
      "network_tier": "residential-fiber",
      "node_id": "volunteer-node-local-smoke6",
      "onboarding_checked_utc": "2026-02-15T20:07:23.868262+00:00",
      "onboarding_status": "passed",
      "region": "eu-west"
    }
  ],
  "notes": "Single-operator multi-machine cohort for public pilot rehearsal; external volunteer intake remains open.",
  "schema_version": 1
}